go,[]
ruby,Error installing libv8: ERROR: Failed to build gem native extension
ruby,Difference between “or” and || in Ruby? [duplicate]
ruby,How to test if parameters exist in rails
ruby,Unable to install gem - Failed to build gem native extension - cannot load such file — mkmf (LoadError)
ruby,Instance variable: self vs @
ruby,Changing every value in a hash in Ruby
ruby,"Uninstall all installed gems, in OSX?"
ruby,Can't install gems on OS X “El Capitan”
ruby,What's the difference between a proc and a lambda in Ruby?
ruby,"In Ruby on Rails, how do I format a date with the “th” suffix, as in, “Sun Oct 5th”?"
ruby,How to split (chunk) a Ruby array into parts of X elements? [duplicate]
ruby,"How can I get the intersection, union, and subset of arrays in Ruby?"
ruby,Best way to pretty print a hash
ruby,Check if a table exists in Rails
ruby,What is the easiest way to remove the first character from a string?
ruby,Converting string from snake_case to CamelCase in Ruby
ruby,How to find and return a duplicate value in array
ruby,How do I get ruby to print a full backtrace instead of a truncated one?
ruby,Add timestamps to an existing table
ruby,How do you round a float to 2 decimal places in JRuby?
ruby,Testing modules in rspec
ruby,Is it possible to run a single test in MiniTest?
ruby,How to get a substring of text?
ruby,The 'json' native gem requires installed build tools
ruby,How do I move a file with Ruby?
ruby,How to create a file in Ruby
ruby,Installing CocoaPods: no response
ruby,How to compare strings ignoring the case
ruby,What does the (unary) * operator do in this Ruby code?
ruby,"RVM is not a function, selecting rubies with 'rvm use …' will not work"
ruby,Double vs single quotes
ruby,What is the difference between Raising Exceptions vs Throwing Exceptions in Ruby?
ruby,Equivalent of .try() for a hash to avoid “undefined method” errors on nil? [duplicate]
ruby,What does &. (ampersand dot) mean in Ruby?
ruby,Best practices to handle routes for STI subclasses in rails
ruby,How to convert a string or integer to binary in Ruby?
ruby,How to solve error “Missing `secret_key_base` for 'production' environment” (Rails 4.1)
ruby,Installed Ruby 1.9.3 with RVM but command line doesn't show ruby -v
ruby,Ruby 'require' error: cannot load such file
ruby,Is there a literal notation for an array of symbols?
ruby,RMagick installation: Can't find MagickWand.h
ruby,How to do a newline in output
ruby,Ruby equivalent of virtualenv?
ruby,ZSH complains about RVM __rvm_cleanse_variables: function definition file not found
ruby,How to get last N records with activerecord?
ruby,Ruby capitalize every word first letter
ruby,Is There a Better Way of Checking Nil or Length == 0 of a String in Ruby?
ruby,How to check if a given directory exists in Ruby
ruby,How do I find if a string starts with another string in Ruby?
ruby,Ruby combining an array into one string
ruby,How do I run only specific tests in Rspec?
ruby,Rails: How to change the title of a page?
ruby,EOFError: end of file reached issue with Net::HTTP
ruby,How do I use Ruby for shell scripting?
ruby,Strange \n in base64 encoded string in Ruby
ruby,Create Directory if it doesn't exist with Ruby
ruby,What does @@variable mean in Ruby?
ruby,Why is the shovel operator (<<) preferred over plus-equals (+=) when building a string in Ruby?
ruby,How to get the name of the calling method?
ruby,do..end vs curly braces for blocks in Ruby
ruby,Ruby / Rails: convert int to time OR get time from integer?
ruby,how to solve “ruby installation is missing psych” error?
ruby,Why use symbols as hash keys in Ruby?
ruby,CocoaPods not working in macOS High Sierra
ruby,How to swap keys and values in a hash
ruby,Safe integer parsing in Ruby
ruby,Calling a Method From a String With the Method's Name in Ruby
ruby,Ruby send vs __send__
ruby,"Ruby: How to iterate over a range, but in set increments?"
ruby,How do I specify local .gem files in my Gemfile?
ruby,Interpolating a string into a regex
ruby,Ruby on Rails: how to render a string as HTML?
ruby,Why does installing Nokogiri on Mac OS fail with libiconv is missing?
ruby,How to sort a Ruby Hash by number value?
ruby,How do I create a SHA1 hash in ruby?
ruby,Ruby arrays: %w vs %W
ruby,Ruby : How to write a gem? [closed]
ruby,What does tilde-greater-than (~>) mean in Ruby gem dependencies? [duplicate]
ruby,How can I use “puts” to the console without a line break in ruby on rails?
ruby,Array include any value from another array?
ruby,Ignoring GEM because its extensions are not built
ruby,Hidden features of Ruby
ruby,Ruby on Rails console is hanging when loading
ruby,How to debug Ruby scripts [closed]
ruby,Count number of days between two dates
ruby,Get underlined text with Markdown
ruby,How to sort an array of hashes in ruby
ruby,Rails 3 datatypes?
ruby,rhc setup gives error `no such file dl/import`
ruby,Nokogiri installation fails -libxml2 is missing
ruby,How do I globally configure RSpec to keep the '--color' and '--format specdoc' options turned on
ruby,Append class if condition is true in Haml
ruby,Is it good style to explicitly return in Ruby?
ruby,How do you pass arguments to define_method?
ruby,Can't install RMagick 2.13.1. Can't find MagickWand.h.
ruby,What's the difference between URI.escape and CGI.escape?
ruby,How to prevent browser page caching in Rails
ruby,"Rails Model, View, Controller, and Helper: what goes where?"
ruby,Rounding float in Ruby
ruby,"Can you get DB username, pw, database name in Rails?"
ruby,Rails Object to hash
ruby,How to modify PATH for Homebrew?
ruby,How to resolve “gpg: command not found” error during RVM installation?
ruby,"Why does Ruby 1.9.2 remove “.” from LOAD_PATH, and what's the alternative?"
ruby,Rails hidden field undefined method 'merge' error
ruby,leading zeros in rails
ruby,Ruby on Rails: Delete multiple hash keys
ruby,Ruby sleep or delay less than a second?
ruby,When to use nested classes and classes nested in modules?
ruby,Ruby: require vs require_relative - best practice to workaround running in both Ruby <1.9.2 and >=1.9.2
ruby,List of installed gems?
ruby,What is a elegant way in Ruby to tell if a variable is a Hash or an Array?
ruby,Dynamic constant assignment
ruby,Accessing a class's constants
ruby,Create a devise user from Ruby console
ruby,Where to define custom error types in Ruby and/or Rails?
ruby,Look up all descendants of a class in Ruby
ruby,Why doesn't ruby support method overloading?
ruby,How to capitalize the first letter in a String in Ruby
ruby,How can I merge two hashes without overwritten duplicate keys in Ruby?
ruby,Continuous Integration for Ruby on Rails? [closed]
ruby,Generating Guids in Ruby
ruby,How can I find the number of days between two Date objects in Ruby?
ruby,'sudo gem install' or 'gem install' and gem locations
ruby,Rails: Open link in new tab (with 'link_to')
ruby,Could not locate Gemfile
ruby,How to change default timezone for Active Record in Rails?
ruby,ERROR: While executing gem … (Errno::EPERM) Operation not permitted [duplicate]
ruby,How to URL encode a string in Ruby
ruby,The authorization mechanism you have provided is not supported. Please use AWS4-HMAC-SHA256
ruby,Get current stack trace in Ruby without raising an exception
ruby,How do I convert a String object into a Hash object?
ruby,How to get UTC timestamp in Ruby?
ruby,How can I avoid running ActiveRecord callbacks?
ruby,Need a simple explanation of the inject method
ruby,Why does Ruby have both private and protected methods?
ruby,"Count, size, length…too many choices in Ruby?"
ruby,All but last element of Ruby array
ruby,In Ruby how do I generate a long string of repeated text?
ruby,How to convert JSON to a Ruby hash
ruby,How do RVM and rbenv actually work?
ruby,Serving static files with Sinatra
ruby,Checking if a variable is an integer
ruby,Ruby Array find_first object?
ruby,"What is Ruby equivalent of Python's `s= “hello, %s. Where is %s?” % (“John”,“Mary”)`"
ruby,What's the best way to unit test protected & private methods in Ruby?
ruby,"You have already activated X, but your Gemfile requires Y"
ruby,What Ruby IDE do you prefer? [closed]
ruby,What is the difference between tr and gsub?
ruby,A copy of xxx has been removed from the module tree but is still active
ruby,Removing all empty elements from a hash / YAML?
ruby,"Pass a variable into a partial, rails 3?"
ruby,Ruby class types and case statements
ruby,How to extract URL parameters from a URL with Ruby or Rails?
ruby,Ruby: Installing rmagick on Ubuntu
ruby,Sorting an array of objects in Ruby by object attribute?
ruby,The command rbenv install is missing
ruby,How to express infinity in Ruby?
ruby,How do I list all versions of a gem available at a remote site?
ruby,RVM: Uninstalling all gems of a gemset
ruby,The Ruby %r{ } expression
ruby,What's the best/easiest GUI Library for Ruby? [closed]
ruby,Rails: What's a good way to validate links (URLs)?
ruby,"JRuby on Rails vs. Ruby on Rails, what's difference?"
ruby,Determining if a variable is within range?
ruby,Create array of symbols
ruby,Rails formatting date
ruby,Deleting all records in a database table
ruby,Check whether a variable is a string in Ruby
ruby,Automatic counter in Ruby for each?
ruby,Using Rails serialize to save hash to database
ruby,What is the meaning of erb?
ruby,Get file name and extension in Ruby
ruby,Convert to/from DateTime and Time in Ruby
ruby,How to return a part of an array in Ruby?
ruby,How do I download a binary file over HTTP?
ruby,What does !! mean in ruby?
ruby,Why doesn't Ruby support i++ or i--​ (increment/decrement operators)?
ruby,Extract a substring from a string in Ruby using a regular expression
ruby,Best way to create custom config options for my Rails app?
ruby,Create a new Ruby on Rails application using MySQL instead of SQLite
ruby,Ruby convert Object to Hash
ruby,How to select option in drop down using Capybara
ruby,Rails 3: Get Random Record
ruby,Uniq by object attribute in Ruby
ruby,Best practice to mark deprecated code in Ruby?
ruby,All Ruby tests raising: undefined method `authenticate' for nil:NilClass
ruby,ruby send method passing multiple parameters
ruby,Learning Python from Ruby; Differences and Similarities
ruby,Ruby's ||= (or equals) in JavaScript?
ruby,How to change Hash values?
ruby,How to click first link in list of items after upgrading to Capybara 2.0?
ruby,What is the difference between Gemfile and Gemfile.lock in Ruby on Rails
ruby,How to test if a string is basically an integer in quotes using Ruby
ruby,How to check a checkbox in capybara?
ruby,How to check if a Ruby object is a Boolean
ruby,What is the best way to convert an array to a hash in Ruby
ruby,What's the 'Ruby way' to iterate over two arrays at once
ruby,Rails 4 LIKE query - ActiveRecord adds quotes
ruby,What is the difference between `after_create` and `after_save` and when to use which?
ruby,How do I create directory if none exists using File class in Ruby?
ruby,Why is sum so much faster than inject(:+)?
ruby,Get person's age in Ruby
ruby,Strip html from string Ruby on Rails
ruby,How to randomly sort (scramble) an array in Ruby?
ruby,"Ruby Regexp group matching, assign variables on 1 line"
ruby,ruby inheritance vs mixins
ruby,ruby operator “=~” [duplicate]
ruby,Resque vs Sidekiq? [closed]
ruby,How to clear all the jobs from Sidekiq?
ruby,Trouble comparing time with RSpec
ruby,Ubuntu rails install fails on zlib
ruby,Find value in an array
ruby,Passing a method as a parameter in Ruby
ruby,Is there a performance gain in using single quotes vs double quotes in ruby?
ruby,Ideal Ruby project structure
ruby,Ruby - elegantly convert variable to an array if not an array already
ruby,Finding out current index in EACH loop (Ruby) [duplicate]
ruby,How to implement an abstract class in ruby?
ruby,How do I create a class instance from a string name in ruby?
ruby,"In Rails, how do you render JSON using a view?"
ruby,What is the difference between ~> and >= when specifying rubygem in Gemfile?
ruby,What does rake db:test:prepare actually do?
ruby,Ruby: How to convert a string to boolean
ruby,What is the difference between pluck and collect in Rails?
ruby,Ruby replace string with captured regex pattern
ruby,Is there any difference between the `:key => “value”` and `key: “value”` hash notations?
ruby,How does one use rescue in Ruby without the begin and end block
ruby,How to run Rails console in the test environment and load test_helper.rb?
ruby,How to search file text for a pattern and replace it with a given value
ruby,How to list all methods for an object in Ruby?
ruby,How do I sort an array of hashes by a value in the hash?
ruby,What is meant by 'Assignment Branch Condition Size too high' and how to fix it?
ruby,Getting “Warning! PATH is not properly set up” when doing rvm use 2.0.0 --default
ruby,Convert duration to hours:minutes:seconds (or similar) in Rails 3 or Ruby
ruby,Save image from URL by paperclip
ruby,Ruby Hash to array of values
ruby,Convert a string to regular expression ruby
ruby,How to compare versions in Ruby?
ruby,Ruby optional parameters
ruby,How to write to a JSON file in the correct format
ruby,Creating an empty file in Ruby: “touch” equivalent?
ruby,Can you supply arguments to the map(&:method) syntax in Ruby?
ruby,rails + MySQL on OSX: Library not loaded: libmysqlclient.18.dylib
ruby,Using --no-rdoc and --no-ri with bundler
ruby,Why use Ruby instead of Smalltalk? [closed]
ruby,How can I remove the string “\n” from within a Ruby string?
ruby,Block comments in html.erb templates in rails
ruby,Rubocop Linelength: How to ignore lines with comments?
java,Why is processing a sorted array faster than processing an unsorted array?
java,Why Is Subtracting These Two Times (in 1927) Giving A Strange Result?
java,Is Java “pass-by-reference” or “pass-by-value”?
java,How do I read / convert an InputStream into a String in Java?
java,Avoiding NullPointerException in Java
java,What are the differences between a HashMap and a Hashtable in Java?
java,Create ArrayList from array
java,Proper use cases for Android UserManager.isUserAGoat()?
java,"Why don't Java's +=, -=, *=, /= compound assignment operators require casting?"
java,How do I generate random integers within a specific range in Java?
java,Why is char[] preferred over String for passwords?
java,How do I efficiently iterate over each entry in a Java Map?
java,Iterate through a HashMap [duplicate]
java,How can I create a memory leak in Java?
java,"What is the difference between public, protected, package-private and private in Java?"
java,When to use LinkedList over ArrayList in Java?
java,How do I convert a String to an int in Java?
java,What is a serialVersionUID and why should I use it?
java,Initialization of an ArrayList in one line
java,"How do I test a private function or a class that has private methods, fields or inner classes?"
java,Why is printing “B” dramatically slower than printing “#”?
java,How can I create an executable JAR with dependencies using Maven?
java,How to fix 'android.os.NetworkOnMainThreadException'?
java,Does a finally block always get executed in Java?
java,How do I determine whether an array contains a particular value in Java?
java,How do I call one constructor from another in Java?
java,What is reflection and why is it useful?
java,"What's the difference between @Component, @Repository & @Service annotations in Spring?"
java,“implements Runnable” vs “extends Thread” in Java
java,How do I declare and initialize an array in Java?
java,How to get an enum value from a string value in Java?
java,How do you assert that a certain exception is thrown in JUnit 4 tests?
java,What's the simplest way to print a Java array?
java,How to use java.net.URLConnection to fire and handle HTTP requests?
java,What is a JavaBean exactly?
java,How do I break out of nested loops in Java?
java,Java inner class and static nested class
java,Comparing Java enum members: == or equals()?
java,How to generate a random alpha-numeric string
java,Why does this code using random strings print “hello world”?
java,Does Java support default parameter values?
java,How to split a string in Java
java,"Sort a Map<Key, Value> by values"
java,"How can I avoid Java code in JSP files, using JSP 2?"
java,Difference between StringBuilder and StringBuffer
java,Why use getters and setters/accessors?
java,How to fix java.lang.UnsupportedClassVersionError: Unsupported major.minor version
java,How do I create a Java string from the contents of a file?
java,How can I convert a stack trace to a string?
java,How does the Java 'for each' loop work?
java,Why does Java have transient fields?
java,What does “Could not find or load main class” mean?
java,Fastest way to determine if an integer's square root is an integer
java,How can I concatenate two arrays in Java?
java,What exactly is Apache Camel?
java,How do I create a file and write to it?
java,Is null check needed before calling instanceof?
java,Why is executing Java code in comments with certain Unicode characters allowed?
java,How to round a number to n decimal places in Java
java,How to add local jar files to a Maven project?
java,'Must Override a Superclass Method' Errors after importing a project into Eclipse
java,How to directly initialize a HashMap (in a literal way)?
java,Difference between wait() and sleep()
java,"Iterating through a Collection, avoiding ConcurrentModificationException when removing objects in a loop"
java,Android SDK installation doesn't find JDK
java,Sort ArrayList of custom Objects by property
java,"How do servlets work? Instantiation, sessions, shared variables and multithreading"
java,Convert ArrayList<String> to String[] array [duplicate]
java,How can I initialise a static Map?
java,What are the -Xms and -Xmx parameters when starting JVM?
java,How to parse JSON in Java
java,How to create a generic array in Java?
java,What are the possible values of the Hibernate hbm2ddl.auto configuration and what do they do
java,How to get the current working directory in Java?
java,How to install Java 8 on Mac
java,Converting 'ArrayList<String> to 'String[]' in Java
java,Can't execute jar- file: “no main manifest attribute”
java,Which @NotNull Java annotation should I use?
java,Converting array to list in Java
java,How can I pad an integer with zeros on the left?
java,"Download a file with Android, and showing the progress in a ProgressDialog"
java,Including all the jars in a directory within the Java classpath
java,"What is the difference between canonical name, simple name and class name in Java Class?"
java,How can I generate an MD5 hash?
java,What does 'synchronized' mean?
java,How can I get the current stack trace in Java?
java,Why can't I use switch statement on a String?
java,How to mock void methods with Mockito
java,:: (double colon) operator in Java 8
java,"Difference between HashMap, LinkedHashMap and TreeMap"
java,Static Classes In Java
java,Why doesn't RecyclerView have onItemClickListener()?
java,Can't start Eclipse - Java was started but returned exit code=13
java,StringBuilder vs String concatenation in toString() in Java
java,"Java 8 List<V> into Map<K, V>"
java,What is the difference between JDK and JRE?
java,Reading a plain text file in Java
java,When to use static methods
java,How to set or change the default Java (JDK) version on OS X?
java,How to resolve java.lang.NoClassDefFoundError: javax/xml/bind/JAXBException
java,Failed to load the JNI shared Library (JDK)
java,Place cursor at the end of text in EditText
java,How to create RecyclerView with multiple view type?
java,How to check if a String is numeric in Java
java,How to reference a method in javadoc?
java,Java string to date conversion
java,What exactly is a Maven Snapshot and why do we need it?
java,Error:java: javacTask: source release 8 requires target release 1.8
java,When and how should I use a ThreadLocal variable?
java,How do I write a correct micro-benchmark in Java?
java,How do I convert a String to an InputStream in Java?
java,Convert InputStream to byte array in Java
java,How do I time a method's execution in Java?
java,A 'for' loop to iterate over an enum in Java
java,What do 3 dots next to a parameter type mean in Java?
java,How can I read a large text file line by line using Java?
java,How to configure port for a Spring Boot application
java,Difference between <? super T> and <? extends T> in Java [duplicate]
java,How do I check if a file exists in Java?
java,How to use Jackson to deserialise an array of objects
java,Why is 2 * (i * i) faster than 2 * i * i in Java?
java,Java optional parameters
java,How to convert a char to a String?
java,How to convert a Java 8 Stream to an Array?
java,Error java.lang.OutOfMemoryError: GC overhead limit exceeded
java,"What is the difference between JSF, Servlet and JSP?"
java,Efficiency of Java “Double Brace Initialization”?
java,How do I join two lists in Java?
java,What is the Java equivalent for LINQ? [closed]
java,How do I copy an object in Java?
java,What's the difference between SoftReference and WeakReference in Java?
java,What is a daemon thread in Java?
java,Access restriction on class due to restriction on required library rt.jar?
java,What is an efficient way to implement a singleton pattern in Java? [closed]
java,Linking to an external URL in Javadoc?
java,How to pass an object from one activity to another on Android
java,How do I tell Maven to use the latest version of a dependency?
java,Unfortunately MyApp has stopped. How can I solve this?
java,What is difference between CrudRepository and JpaRepository interfaces in Spring Data JPA?
java,File to byte[] in Java
java,How to make a new List in Java
java,How to call a method after a delay in Android
java,How do I discover memory usage of my application in Android?
java,Is List<Dog> a subclass of List<Animal>? Why are Java generics not implicitly polymorphic?
java,What's the difference between map() and flatMap() methods in Java 8?
java,How to initialize HashSet values by construction?
java,Correct way to add external jars (lib/*.jar) to an IntelliJ IDEA project
java,What is PECS (Producer Extends Consumer Super)?
java,Where is Java Installed on Mac OS X?
java,Scanner is skipping nextLine() after using next() or nextFoo()?
java,Why does array[idx++]+=“a” increase idx once in Java 8 but twice in Java 9 and 10?
java,"Jackson with JSON: Unrecognized field, not marked as ignorable"
java,How to convert an Array to a Set in Java
java,Java URL encoding of query string parameters
java,Dealing with “Xerces hell” in Java/Maven?
java,How do I convert from int to String?
java,How do I get a class instance of generic type T?
java,Implements vs extends: When to use? What's the difference?
java,Differences between Oracle JDK and OpenJDK
java,How to get the current date/time in Java [duplicate]
java,Making a mocked method return an argument that was passed to it
java,Can I catch multiple Java exceptions in the same catch clause?
java,What is the equivalent of Java static methods in Kotlin?
java,How do I save a String to a text file using Java?
java,How to tell Jackson to ignore a field during serialization if its value is null?
java,decompiling DEX into Java sourcecode
java,Removing whitespace from strings in Java
java,What is the difference between @Inject and @Autowired in Spring Framework? Which one to use under what condition?
java,How do I compare strings in Java?
java,Understanding checked vs unchecked exceptions in Java
java,How to read all files in a folder from Java?
java,What is the volatile keyword useful for?
java,Converting ISO 8601-compliant String to java.util.Date
java,What is a raw type and why shouldn't we use it?
java,How to convert a Map to List in Java?
java,Can I add jars to maven 2 build classpath without installing them?
java,How to append text to an existing file in Java?
java,How to verify that a specific method was not called using Mockito?
java,SLF4J: Failed to load class “org.slf4j.impl.StaticLoggerBinder”
java,Difference between <context:annotation-config> and <context:component-scan>
java,How do I invoke a Java method when given the method name as a string?
java,"What is a stack trace, and how can I use it to debug my application errors?"
java,Using context in a fragment
java,What is the best way to filter a Java Collection?
java,Why is Java Vector (and Stack) class considered obsolete or deprecated?
java,How to upload files to server using JSP/Servlet?
java,How to get the current time in YYYY-MM-DD HH:MI:Sec.Millisecond format in Java?
java,"What is the equivalent of the C++ Pair<L,R> in Java?"
java,How to convert a byte array to a hex string in Java?
java,No compiler is provided in this environment. Perhaps you are running on a JRE rather than a JDK?
java,How to check internet access on Android? InetAddress never times out
java,What's the difference between JPA and Hibernate? [closed]
java,How to fix the Hibernate “object references an unsaved transient instance - save the transient instance before flushing” error
java,IntelliJ: Never use wildcard imports
java,Examples of GoF Design Patterns in Java's core libraries
java,Sending Email in Android using JavaMail API without using the default/built-in app
java,What is the difference between == and equals() in Java?
java,"How to update a value, given a key in a hashmap?"
java,Set ImageView width and height programmatically?
java,How can I clear or empty a StringBuilder? [duplicate]
java,How to add local .jar file dependency to build.gradle file?
java,Why are static variables considered evil?
java,Ignoring new fields on JSON objects using Jackson [duplicate]
java,Can an abstract class have a constructor?
java,Simple way to repeat a string
java,Easiest way to convert a List to a Set in Java
java,IntelliJ show JavaDocs tooltip on mouse over
java,Any way to declare an array in-line?
java,How to get the last value of an ArrayList
java,Why is my Spring @Autowired field null?
