go,[]
css,Remove Safari/Chrome textinput/textarea glow
css,Less aggressive compilation with CSS3 calc
css,CSS technique for a horizontal line with words in the middle
css,How to remove the underline for anchors(links)?
css,How can I find an element by CSS class with XPath?
css,Is there a CSS selector for the first direct child only?
css,How to justify a single flexbox item (override justify-content)
css,CSS customized scroll bar in div
css,CSS3's border-radius property and border-collapse:collapse don't mix. How can I use border-radius to create a collapsed table with rounded corners?
css,Should I size a textarea with CSS width / height or HTML cols / rows attributes?
css,How to load up CSS files using Javascript?
css,Can CSS detect the number of children an element has?
css,Why doesn't height: 100% work to expand divs to the screen height?
css,Fluid width with equally spaced DIVs
css,How can I apply styles to multiple classes at once?
css,Pure CSS to make font-size responsive based on dynamic amount of characters
css,Specify multiple attribute selectors in CSS
css,Position a CSS background image x pixels from the right?
css,How to Save up Another Precious HTTP-request for The Tiny Favicon?
css,Table fixed header and scrollable body
css,How can I have two fixed width columns with one flexible column in the center?
css,Align image in center and middle within div
css,Hide text using css
css,"Using only CSS, show div on hover over <a>"
css,Bootstrap dropdown sub menu missing
css,How to make blinking/flashing text with CSS 3
css,Div width 100% minus fixed amount of pixels
css,Flexbox: 4 items per row
css,Expanding a parent <div> to the height of its children
css,Complex CSS selector for parent of active child [duplicate]
css,"What replaces cellpadding, cellspacing, valign, and align in HTML5 tables?"
css,css selector to match an element without attribute x [duplicate]
css,"Why should we include ttf, eot, woff, svg,… in a font-face"
css,How can I make a div stick to the top of the screen once it's been scrolled to?
css,Modify SVG fill color when being served as Background-Image
css,How to remove the default arrow icon from a dropdown list (select element)?
css,How to dynamically create CSS class in JavaScript and apply?
css,Is it possible to put CSS @media rules inline?
css,How to create a radial menu in CSS?
css,Is it possible to set the stacking order of pseudo-elements below their parent element? [duplicate]
css,How to increase space between dotted border dots
css,What does the smiley face “:)” mean in CSS?
css,"Flushing footer to bottom of the page, twitter bootstrap"
css,Inline SVG in CSS
css,Can I have multiple background images using CSS?
css,Auto-size dynamic text to fill fixed size container
css,Use Font Awesome Icons in CSS
css,How to make button look like a link?
css,Is CSS Turing complete?
css,Can't scroll to top of flex item that is overflowing container
css,CSS Child vs Descendant selectors
css,Hiding elements in responsive layout?
css,How do I conditionally apply CSS styles in AngularJS?
css,What does the CSS rule “clear: both” do?
css,How to prevent text in a table cell from wrapping
css,Bootstrap: align input with button
css,How can I style even and odd elements?
css,Why is there an unexplainable gap between these inline-block div elements? [duplicate]
css,What is WebKit and how is it related to CSS?
css,How do you get the footer to stay at the bottom of a Web page?
css,How do I change Bootstrap 3 column order on mobile layout?
css,top nav bar blocking top content of the page
css,"With CSS, use “…” for overflowed block of multi-lines"
css,Put icon inside input element in a form
css,Transition of background-color
css,Fit cell width to content
css,How to style child components from parent component's CSS file?
css,Why did the width collapse in the percentage width child element in an absolutely positioned parent on Internet Explorer 7?
css,Use Font Awesome icon as CSS content
css,Can jQuery get all CSS styles associated with an element?
css,Making button go full-width?
css,How do I get a div to float to the bottom of its container?
css,How to prevent column break within an element?
css,Using two CSS classes on one element [duplicate]
css,How to get div height to auto-adjust to background size?
css,Need to remove href values when printing in Chrome
css,What is the difference between :focus and :active?
css,How can I check if a scrollbar is visible?
css,Best way to include CSS? Why use @import?
css,How to make certain text not selectable with CSS [duplicate]
css,How do I create an HTML table with a fixed/frozen left column and a scrollable body?
css,What is the difference between background and background-color
css,MVC4 StyleBundle not resolving images
css,“Uncaught TypeError: a.indexOf is not a function” error when opening new foundation project
css,What is the standard naming convention for html/css ids and classes?
css,What do the crossed style properties in Google Chrome devtools mean?
css,text-overflow: ellipsis not working
css,"jQuery SVG, why can't I addClass?"
css,Can I change the color of Font Awesome's icon color?
css,Using CSS to affect div style inside iframe
css,Any recommendations for a CSS minifier? [closed]
css,Twitter Bootstrap - how to center elements horizontally or vertically
css,Add a space (“ ”) after an element using :after
css,CSS3 Transparency + Gradient
css,Is there a way to use SVG as content in a pseudo element :before or :after
css,Does :before not work on img elements?
css,Gradient borders
css,How to change the height of a <br>?
css,How can I reorder my divs using only CSS?
css,"Floating elements within a div, floats outside of div. Why?"
css,CSS3 Rotate Animation
css,How to specify line breaks in a multi-line flexbox layout?
css,Can I position an element fixed relative to parent? [duplicate]
css,CSS strikethrough different color from text?
css,HTML+CSS: How to force div contents to stay in one line?
css,How to keep indent for second line in ordered lists via CSS?
css,Make Iframe to fit 100% of container's remaining height
css,CSS rule to apply only if element has BOTH classes [duplicate]
css,Hide html horizontal but not vertical scrollbar
css,How to float 3 divs side by side using CSS?
css,float:left; vs display:inline; vs display:inline-block; vs display:table-cell;
css,Make div stay at bottom of page's content all the time even when there are scrollbars
css,How to disable HTML links
css,Firebug-like debugger for Google Chrome
css,Bootstrap 3 modal vertical position center
css,Keep overflow div scrolled to bottom unless user scrolls up
css,How do I disable text selection with CSS or JavaScript? [duplicate]
css,Can I change the height of an image in CSS :before/:after pseudo-elements?
css,How to remove indentation from an unordered list item?
css,How do I center an SVG in a div?
css,Does height and width not apply to span?
css,Single huge .css file vs. multiple smaller specific .css files? [closed]
css,How to import Google Web Font in CSS file?
css,How to select label for=“XYZ” in CSS?
css,Fill the remaining height or width in a flex container
css,How to use CSS to surround a number with a circle?
css,How to remove focus around buttons on click
css,How can I make an svg scale with its parent container?
css,Unusual shape of a textarea?
css,How to deal with page breaks when printing a large HTML table
css,Why is vertical-align: middle not working on my span or div?
css,How do I position one image on top of another in HTML?
css,"Check, using jQuery, if an element is 'display:none' or block on click"
css,How can I align one item right with flexbox?
css,Style disabled button with CSS
css,How to override !important?
css,How can I get a specific number child using CSS?
css,Chrome / Safari not filling 100% height of flex parent
css,How to change the style of the title attribute inside an anchor tag?
css,Render a string in HTML and preserve spaces and linebreaks
css,How to remove the default link color of the html hyperlink 'a' tag?
css,Is there an equivalent to background-size: cover and contain for image elements?
css,How do you make div elements display inline?
css,Make the first character Uppercase in CSS
css,Select all 'tr' except the first one
css,Can I set background image and opacity in the same property?
css,How to not wrap contents of a div?
css,"CSS: How to remove pseudo elements (after, before,…)?"
css,How to clear the cache of nginx?
css,Remove white space below image [duplicate]
css,How to place div side by side
css,Prevent line-break of span element
css,How to center buttons in Twitter Bootstrap 3?
css,HTML colspan in CSS
css,How does the “position: sticky;” property work?
css,Can I use non existing CSS classes?
css,Full-screen iframe with a height of 100%
css,How can I rotate an HTML <div> 90 degrees?
css,CSS content property: is it possible to insert HTML instead of Text?
css,How to center an iframe horizontally?
css,Landscape printing from HTML
css,How to make a floated div 100% height of its parent?
css,How to align center the text in html table row?
css,How can I override Bootstrap CSS styles?
css,What's a 3D doing in this HTML?
css,What does it mean when a CSS rule is grayed out in Chrome's element inspector?
css,Can you use CSS to mirror/flip text?
css,CSS3 selector :first-of-type with class name?
css,jQuery: Get height of hidden element in jQuery
css,How can I scale the content of an iframe?
css,Creating rounded corners using CSS [closed]
css,Inspect webkit-input-placeholder with developer tools
css,How to hide elements without having them take space on the page?
css,Scrolling a flexbox with overflowing content
css,Is there are way to make a child DIV's width wider than the parent DIV using CSS?
css,sass --watch with automatic minify?
css,change cursor to finger pointer
css,How can I force WebKit to redraw/repaint to propagate style changes?
css,Select every Nth element in CSS
css,How to make my font bold using css?
css,What are the differences between flex-basis and width?
css,CSS – why doesn’t percentage height work? [duplicate]
css,Overflow:hidden dots at the end
css,Match all elements having class name starting with a specific string [duplicate]
css,SASS - use variables across multiple files
python,What does the “yield” keyword do?
python,What does if __name__ == “__main__”: do?
python,Does Python have a ternary conditional operator?
python,What are metaclasses in Python?
python,How do I check whether a file exists without exceptions?
python,How do I merge two dictionaries in a single expression (taking union of dictionaries)?
python,How to execute a program or call a system command from Python
python,How can I safely create a nested directory?
python,Accessing the index in 'for' loops?
python,How to make a flat list out of a list of lists?
python,Difference between staticmethod and classmethod
python,Understanding slice notation
python,Does Python have a string 'contains' substring method?
python,Finding the index of an item in a list
python,How do I list all files of a directory?
python,Iterating over dictionaries using 'for' loops
python,How do I sort a dictionary by value?
python,Using global variables in a function
python,How do I check if a list is empty?
python,How to get the current time in Python
python,What is the difference between Python's list methods append and extend?
python,Catch multiple exceptions in one line (except block)
python,What is the difference between __str__ and __repr__?
python,How can I add new keys to a dictionary?
python,How can I make a time delay in Python? [duplicate]
python,How do I concatenate two lists in Python?
python,How can a file be copied?
python,How to make function decorators and chain them together?
python,How do I pass a variable by reference?
python,List changes unexpectedly after assignment. Why is this and how to prevent it?
python,“Least Astonishment” and the Mutable Default Argument
python,Convert bytes to a string
python,Understanding Python super() with __init__() methods [duplicate]
python,Check if a given key already exists in a dictionary
python,What is __init__.py for?
python,How to iterate over rows in a DataFrame in Pandas
python,What does ** (double star/asterisk) and * (star/asterisk) do for parameters?
python,How can I install pip on Windows?
python,How do you split a list into evenly sized chunks?
python,Manually raising (throwing) an exception in Python
python,How to delete a file or folder?
python,Find current directory and file's directory [duplicate]
python,How to select rows from a DataFrame based on column values
python,How do you change the size of figures drawn with matplotlib?
python,How to print colored text to the terminal?
python,How to access environment variable values?
python,How do I parse a string to a float or int?
python,Converting string into datetime
python,Why is “1000000000000000 in range(1000000000000001)” so fast in Python 3?
python,Getting the last element of a list
python,How do I get a substring of a string in Python?
python,How to upgrade all Python packages with pip
python,How do I lowercase a string in Python?
python,Renaming columns in Pandas
python,How do I sort a list of dictionaries by a value of the dictionary?
python,How can I remove a key from a Python dictionary?
python,Are static class variables possible in Python?
python,Is there a way to run Python on Android?
python,How to print without newline or space?
python,How do I get the number of elements in a list?
python,How to read a file line-by-line into a list?
python,Why is reading lines from stdin much slower in C++ than Python?
python,Calling a function of a module by using its name (a string)
python,How to randomly select an item from a list?
python,Determine the type of an object?
python,Limiting floats to two decimal points
python,How to know if an object has an attribute in Python
python,Why is it string.join(list) instead of list.join(string)?
python,How to leave/exit/deactivate a Python virtualenv
python,How can I remove a trailing newline?
python,Static methods in Python?
python,How to determine a Python variable's type?
python,How can I print literal curly-brace characters in a string and also use .format on it?
python,Importing files from different folder
python,How to remove an element from a list by index
python,How do I check if a string is a number (float)?
python,How do you append to a file?
python,How can I count the occurrences of a list item?
python,Replacements for switch statement in Python?
python,Meaning of @classmethod and @staticmethod for beginner? [duplicate]
python,How do I install pip on macOS or OS X?
python,Delete an element from a dictionary
python,How to pad zeroes to a string?
python,How to check if the string is empty?
python,Getting the class name of an instance?
python,Delete column from pandas DataFrame
python,How do you read from stdin?
python,Installing specific package versions with pip
python,Pythonic way to create a long multi-line string
python,Generate random integers between 0 and 9
python,Why can't Python parse this JSON data?
python,How to measure elapsed time in Python?
python,How to print to stderr in Python?
python,Use of *args and **kwargs [duplicate]
python,Random string generation with upper case letters and digits
python,Extracting extension from filename in Python
python,Converting integer to string in Python
python,Proper way to declare custom exceptions in modern Python?
python,What's the canonical way to check for type in Python?
python,Hidden features of Python [closed]
python,Reverse a string in Python
python,What is the meaning of single and double underscore before an object name?
python,How do I convert two lists into a dictionary?
python,How can you profile a Python script?
python,Why do Python classes inherit object?
python,String formatting: % vs. .format vs. string literal
python,fatal error: Python.h: No such file or directory
python,What is the Python 3 equivalent of “python -m SimpleHTTPServer”
python,UnicodeEncodeError: 'ascii' codec can't encode character u'\xa0' in position 20: ordinal not in range(128)
python,Create a dictionary with list comprehension
python,How can I use threading in Python?
python,How to flush output of print function?
python,What are the differences between type() and isinstance()?
python,Selecting multiple columns in a Pandas dataframe
python,"What is the difference between venv, pyvenv, pyenv, virtualenv, virtualenvwrapper, pipenv, etc?"
python,How to import a module given the full path?
python,Save plot to image file instead of displaying it using Matplotlib
python,How do I check what version of Python is running my script?
python,How to prettyprint a JSON file?
python,Referring to the null object in Python
python,How do I write JSON data to a file?
python,Use different Python version with virtualenv
python,How do I trim whitespace from a string?
python,How to find if directory exists in Python
python,How can I install packages using pip according to the requirements.txt file from a local directory?
python,Is there a way to create multiline comments in Python?
python,How do I get time of a Python program's execution?
python,How do I get the row count of a Pandas DataFrame?
python,Why does comparing strings using either '==' or 'is' sometimes produce a different result?
python,How do I connect to a MySQL Database in Python?
python,How can I check for NaN values?
python,How to get the filename without the extension from a path in Python?
python,What is the purpose of the word 'self'?
python,How to terminate a script?
python,What is setup.py?
python,How can I do a line break (line continuation) in Python?
python,"In Python, how do I determine if an object is iterable?"
python,Does Django scale? [closed]
python,Correct way to write line to file?
python,"If Python is interpreted, what are .pyc files?"
python,Can someone explain __all__ in Python?
python,How to put the legend out of the plot
python,How can I represent an 'Enum' in Python?
python,Removing duplicates in the lists
python,if/else in a list comprehension
python,Best way to return multiple values from a function? [closed]
python,Why do people write #!/usr/bin/env python on the first line of a Python script?
python,How do I trim whitespace?
python,Get list from pandas DataFrame column headers
python,Creating a singleton in Python
python,How can I reverse a list in Python?
python,How do I create a constant in Python?
python,How to get the ASCII value of a character
python,Adding new column to existing DataFrame in Python pandas
python,How to get line count of a large file cheaply in Python?
python,How to read a text file into a string variable and strip newlines?
python,Is there a built-in function to print all the current properties and values of an object?
python,How can I sort a dictionary by key?
python,What is the use of “assert” in Python?
python,How to parse XML and count instances of a particular node attribute?
python,Best way to convert string to bytes in Python 3?
python,How do I find the location of my Python site-packages directory?
python,How to change the order of DataFrame columns?
python,Create pandas Dataframe by appending one row at a time
python,How does the @property decorator work in Python?
python,“Large data” workflows using pandas
python,"Difference between del, remove, and pop on lists"
python,How do I check if a variable exists?
python,"What is a mixin, and why are they useful?"
python,What's the difference between lists and tuples?
python,How can I get a list of locally installed Python modules?
python,What is the difference between null=True and blank=True in Django?
python,Display number with leading zeros
python,How to move a file?
python,How to get file creation & modification date/times in Python?
python,Find all files in a directory with extension .txt in Python
python,Running shell command and capturing the output
python,Count the number occurrences of a character in a string
python,What is the difference between old style and new style classes in Python?
python,What IDE to use for Python? [closed]
python,Putting a simple if-then-else statement on one line [duplicate]
python,How to copy a dictionary and only edit the copy
python,Getting key with maximum value in dictionary?
python,Is there a simple way to delete a list element by value?
python,How do I get the full path of the current file's directory?
python,Change column type in pandas
python,What is the standard Python docstring format? [closed]
python,How do I install a Python package with a .whl file?
python,How does Python's super() work with multiple inheritance?
python,Should I use 'has_key()' or 'in' on Python dicts?
python,Relative imports in Python 3
python,How to iterate through two lists in parallel?
python,Checking whether a variable is an integer or not [duplicate]
python,What are “named tuples” in Python?
python,pg_config executable not found
python,How to make a class JSON serializable
python,What does the 'b' character do in front of a string literal?
python,Fastest way to check if a value exists in a list
python,How to get the home directory in Python?
python,How to drop rows of Pandas DataFrame whose value in a certain column is NaN
python,"Should I put #! (shebang) in Python scripts, and what form should it take?"
python,"Extract file name from path, no matter what the os/path format"
python,Why are Python lambdas useful? [closed]
python,Why use pip over easy_install? [closed]
python,How to return dictionary keys as a list in Python?
python,How to download a file over HTTP?
python,How to import other Python files?
python,How to remove items from a list while iterating?
python,Get difference between two lists
python,How do I remove/delete a folder that is not empty?
python,List comprehension vs. lambda + filter
python,Get unique values from a list in python [duplicate]
python,Relative imports for the billionth time
python,Peak detection in a 2D array
python,How to sort a list of objects based on an attribute of the objects?
python,Remove all whitespace in a string
python,Converting unix timestamp string to readable date
python,How to emulate a do-while loop?
python,How do you test that a Python function throws an exception?
python,How to convert list to string [duplicate]
python,How to catch and print the full exception traceback without halting/exiting the program?
python,Python's equivalent of && (logical-and) in an if-statement
python,Converting from a string to boolean in Python?
python,Get the data received in a Flask request
python,How to overcome “datetime.datetime not JSON serializable”?
python,Behaviour of increment and decrement operators in Python
python,How can I check file size in Python?
python,Convert a String representation of a Dictionary to a dictionary?
python,How do I unload (reload) a Python module?
python,How to print an exception in Python?
python,Maximum and Minimum values for ints
python,How to remove the first Item from a list?
python,How to print number with commas as thousands separators?
python,How to make IPython notebook matplotlib plot inline
python,mkdir -p functionality in Python [duplicate]
python,Multiprocessing vs Threading Python [duplicate]
python,pip install mysql-python fails with EnvironmentError: mysql_config not found
python,How to subtract a day from a date?
python,Python integer incrementing with ++ [duplicate]
python,Usage of __slots__?
python,What __init__ and self do in Python?
python,error: Unable to find vcvarsall.bat
python,Use a list of values to select rows from a pandas dataframe
python,Why does Python code run faster in a function?
python,How to get a function name as a string?
python,python setup.py uninstall
python,How to retrieve a module's path?
python,Convert hex string to int in Python
python,How to properly ignore exceptions
python,How to check if type of a variable is string?
python,How to use a decimal range() step value?
python,What is the naming convention in Python for variable and function names?
python,What is the difference between pip and conda?
python,How to get an absolute file path in Python
python,How do you remove duplicates from a list whilst preserving order?
python,How can I make a Python script standalone executable to run without ANY dependency?
python,Shuffling a list of objects
python,"What are the differences between the urllib, urllib2, urllib3 and requests module?"
python,How to use glob() to find files recursively?
python,How to deal with SettingWithCopyWarning in Pandas
python,Find which version of package is installed with pip
python,Python `if x is not None` or `if not x is None`? [closed]
python,Is there any way to kill a Thread?
python,Convert list of dictionaries to a pandas DataFrame
python,Pretty-print an entire Pandas Series / DataFrame
python,Using Python 3 in virtualenv
python,Traverse a list in reverse order in Python
python,List comprehension vs map
python,Writing a pandas DataFrame to CSV file
python,Is there a list of Pytz Timezones?
python,"What is a clean, Pythonic way to have multiple constructors in Python?"
python,What is the purpose and use of **kwargs?
python,What is the best project structure for a Python application? [closed]
python,How to create a GUID/UUID in Python
python,How do I determine the size of an object in Python?
python,How to define a two-dimensional array?
python,What is __pycache__?
python,How to check version of python modules?
python,Why dict.get(key) instead of dict[key]?
python,Running unittest with typical test directory structure
python,About catching ANY exception
python,How to change a string into uppercase
python,pip install from git repo branch
python,Remove empty strings from a list of strings
python,Import a module from a relative path
python,How to import the class within the same directory or sub directory?
python,"What is __future__ in Python used for and how/when to use it, and how it works"
