go,[]
sql,What is the difference between “INNER JOIN” and “OUTER JOIN”?
sql,How do I UPDATE from a SELECT in SQL Server?
sql,Add a column with a default value to an existing table in SQL Server
sql,How can I prevent SQL injection in PHP?
sql,How does database indexing work? [closed]
sql,How do I import an SQL file using the command line in MySQL?
sql,Finding duplicate values in a SQL table
sql,How to concatenate text from multiple rows into a single text string in SQL server?
sql,How to return only the Date from a SQL Server DateTime datatype
sql,"What's the difference between INNER JOIN, LEFT JOIN, RIGHT JOIN and FULL JOIN? [duplicate]"
sql,Inserting multiple rows in a single SQL query? [duplicate]
sql,Insert results of a stored procedure into a temporary table
sql,How do I perform an IF…THEN in an SQL SELECT?
sql,How to query MongoDB with “like”?
sql,Table Naming Dilemma: Singular vs. Plural Names [closed]
sql,Insert into … values ( SELECT … FROM … )
sql,Select first row in each GROUP BY group?
sql,What is the difference between UNION and UNION ALL?
sql,How can I delete using INNER JOIN with SQL Server?
sql,How can I do an UPDATE statement with JOIN in SQL Server?
sql,What are the options for storing hierarchical data in a relational database?
sql,SQL select only rows with max value on a column [duplicate]
sql,How to reset AUTO_INCREMENT in MySQL?
sql,Find all tables containing column with specified name - MS SQL Server
sql,Can I concatenate multiple MySQL rows into one field?
sql,How to list the tables in a SQLite database file that was opened with ATTACH?
sql,Best way to get identity of inserted row?
sql,Using group by on multiple columns
sql,Get list of all tables in Oracle?
sql,Difference between JOIN and INNER JOIN
sql,How do I limit the number of rows returned by an Oracle query after ordering?
sql,Retrieving the last record in each group - MySQL
sql,Parameterize an SQL IN clause
sql,How do I escape a single quote in SQL Server?
sql,SQL update from one Table to another based on a ID match
sql,INNER JOIN ON vs WHERE clause
sql,Save PL/pgSQL output from PostgreSQL to a CSV file
sql,When should I use cross apply over inner join?
sql,Insert into a MySQL table or update if exists
sql,Join vs. sub-query
sql,How to 'insert if not exists' in MySQL?
sql,Search text in stored procedure in SQL Server
sql,Function vs. Stored Procedure in SQL Server
sql,Should I use != or <> for not equal in T-SQL?
sql,"How can I SELECT rows with MAX(Column value), PARTITION by another column in MYSQL?"
sql,How to Join to first row
sql,SQL exclude a column using SELECT * [except columnA] FROM tableA?
sql,How can I list all foreign keys referencing a given table in SQL Server?
sql,DateTime2 vs DateTime in SQL Server
sql,How can I get column names from a table in SQL Server?
sql,Count(*) vs Count(1) - SQL Server
sql,Reset identity seed after deleting records in SQL Server
sql,SQL JOIN - WHERE clause vs. ON clause
sql,Fastest Way of Inserting in Entity Framework
sql,SQL multiple column ordering
sql,How to do a FULL OUTER JOIN in MySQL?
sql,'IF' in 'SELECT' statement - choose output value based on column values
sql,SQL update query using joins
sql,MySQL Query GROUP BY day / month / year
sql,How can I temporarily disable a foreign key constraint in MySQL?
sql,Rename column SQL Server 2008
sql,SQL injection that gets around mysql_real_escape_string()
sql,"Insert, on duplicate update in PostgreSQL?"
sql,How do I see what character set a MySQL database / table / column is?
sql,postgres: upgrade a user to be a superuser?
sql,"When to use single quotes, double quotes, and backticks in MySQL"
sql,SQL SELECT WHERE field contains words
sql,How Do I Get the Query Builder to Output Its Raw SQL Query as a String?
sql,Solutions for INSERT OR UPDATE on SQL Server
sql,How to insert a line break in a SQL Server VARCHAR/NVARCHAR string
sql,Fetch the row which has the Max value for a column
sql,Skip certain tables with mysqldump
sql,Get top 1 row of each group
sql,How do I restore a dump file from mysqldump?
sql,OR is not supported with CASE Statement in SQL Server
sql,Is it possible to insert multiple rows at a time in an SQLite database?
sql,"What is the difference between Left, Right, Outer and Inner Joins?"
sql,SQLite - UPSERT *not* INSERT or REPLACE
sql,NOT IN vs NOT EXISTS
sql,MySql export schema without data
sql,How to select all records from one table that do not exist in another table?
sql,What is the most efficient/elegant way to parse a flat table into a tree?
sql,How to request a random row in SQL?
sql,Best approach to remove time part of datetime in SQL Server
sql,Is there a Max function in SQL Server that takes two values like Math.Max in .NET?
sql,MySQL: @variable vs. variable. What's the difference?
sql,java.util.Date vs java.sql.Date
sql,What is the best way to paginate results in SQL Server
sql,How to turn IDENTITY_INSERT on and off using SQL Server 2008?
sql,How do I split a string so I can access item x?
sql,UPDATE and REPLACE part of a string
sql,MySQL select 10 random rows from 600K rows fast
sql,Error related to only_full_group_by when executing a query in MySql
sql,How to convert java.util.Date to java.sql.Date?
sql,Adding an identity to an existing column
sql,What is an index in SQL?
sql,SQL Server query - Selecting COUNT(*) with DISTINCT
sql,How to delete duplicate rows in SQL Server?
sql,Difference between EXISTS and IN in SQL?
sql,What is the syntax for an inner join in LINQ to SQL?
sql,Delete all Duplicate Rows except for One in MySQL? [duplicate]
sql,How to create id with AUTO_INCREMENT on Oracle?
sql,SQL query return data from multiple tables
sql,When to use “ON UPDATE CASCADE”
sql,How do I (or can I) SELECT DISTINCT on multiple columns?
sql,Is it possible to specify condition in Count()?
sql,Exporting data In SQL Server as INSERT INTO
sql,Entity Framework VS LINQ to SQL VS ADO.NET with stored procedures? [closed]
sql,how can I Update top 100 records in sql server
sql,How to print a query string with parameter values when using Hibernate
sql,How to declare a variable in MySQL?
sql,How to select the nth row in a SQL database table?
sql,Using LIMIT within GROUP BY to get N results per group?
sql,Explicit vs implicit SQL joins
sql,Nested select statement in SQL Server
sql,Select statement to find duplicates on certain fields
sql,Multiple Updates in MySQL
sql,MySQL error: key specification without a key length
sql,Cannot insert explicit value for identity column in table 'table' when IDENTITY_INSERT is set to OFF
sql,Hibernate show real SQL [duplicate]
sql,Efficiently convert rows to columns in sql server
sql,SQL Server SELECT into existing table
sql,What are DDL and DML?
sql,How to get the insert ID in JDBC?
sql,SQL/mysql - Select distinct/UNIQUE but return all columns?
sql,How to use GROUP BY to concatenate strings in SQL Server?
sql,SQL MAX of multiple columns?
sql,How Stuff and 'For Xml Path' work in SQL Server?
sql,You can't specify target table for update in FROM clause
sql,Remove duplicate rows in MySQL
sql,What is the meaning of the prefix N in T-SQL statements and when should I use it?
sql,How to avoid the “divide by zero” error in SQL?
sql,What's the difference between VARCHAR and CHAR?
sql,Get day of week in SQL Server 2005/2008
sql,How to concatenate strings of a string field in a PostgreSQL 'group by' query?
sql,How do I query for all dates greater than a certain date in SQL Server?
sql,What is the difference between Views and Materialized Views in Oracle?
sql,How to use GROUP BY to concatenate strings in MySQL?
sql,How to select rows with no matching entry in another table?
sql,How to replace a string in a SQL Server Table Column
sql,"What is the difference between SQL, PL-SQL and T-SQL?"
sql,Selecting data from two different servers in SQL Server
sql,Is a view faster than a simple query?
sql,Best way to select random rows PostgreSQL
sql,How to get multiple counts with one SQL query?
sql,Best database field type for a URL
sql,Is there a combination of “LIKE” and “IN” in SQL?
sql,Postgres and Indexes on Foreign Keys and Primary Keys
sql,Postgres DB Size Command
sql,Get record counts for all tables in MySQL database
sql,Can a foreign key be NULL and/or duplicate?
sql,SQL to find the number of distinct values in a column
sql,Convert INT to VARCHAR SQL
sql,How to insert a value that contains an apostrophe (single quote)?
sql,Best way to test if a row exists in a MySQL table
sql,Oracle: If Table Exists
sql,SQL Server - SELECT FROM stored procedure
sql,How to set variable from a SQL query?
sql,Altering a column to be nullable
sql,updating table rows in postgres using subquery
sql,What represents a double in sql server?
sql,"Update a column value, replacing part of a string"
sql,What is the equivalent of 'describe table' in SQL Server?
sql,How can I see the raw SQL queries Django is running?
sql,Are there any disadvantages to always using nvarchar(MAX)?
sql,"Difference between numeric, float and decimal in SQL Server"
sql,SQL Server - stop or break execution of a SQL script
sql,Is there any difference between GROUP BY and DISTINCT
sql,Simulating group_concat MySQL function in Microsoft SQL Server 2005?
sql,How do I obtain a Query Execution Plan in SQL Server?
sql,MySQL Error: : 'Access denied for user 'root'@'localhost'
sql,SQL Inner-join with 3 tables?
sql,SQL Server - Return value after INSERT
sql,SET NOCOUNT ON usage
sql,SQL statement to get column type
sql,Connect different Windows User in SQL Server Management Studio (2005 or later)
sql,How can I select the first day of a month in SQL?
sql,Validation failed for one or more entities while saving changes to SQL Server Database using Entity Framework
sql,Django CharField vs TextField
sql,How to perform OR condition in django queryset?
sql,SQL join: selecting the last records in a one-to-many relationship
sql,SQL query to select dates between two dates
sql,What datatype to use when storing latitude and longitude data in SQL databases? [duplicate]
sql,Get table column names in MySQL?
sql,MySQL Cannot Add Foreign Key Constraint
sql,T-SQL Cast versus Convert
sql,What's the difference between TRUNCATE and DELETE in SQL
sql,Find records from one table which don't exist in another
sql,How to create a MySQL hierarchical recursive query?
sql,must appear in the GROUP BY clause or be used in an aggregate function
sql,Get all table names of a particular database by SQL query?
sql,How can I return pivot table output in MySQL?
sql,How do I see active SQL Server connections?
sql,Getting the SQL from a Django QuerySet [duplicate]
sql,MySQL query String contains
sql,Copy tables from one database to another in SQL Server
sql,Dynamic SELECT TOP @var In SQL Server
sql,"Error 1046 No database Selected, how to resolve?"
sql,Select n random rows from SQL Server table
sql,How can I search (case-insensitive) in a column using LIKE wildcard?
sql,"How to implement one-to-one, one-to-many and many-to-many relationships while designing tables?"
sql,Update statement with inner join on Oracle
sql,SQL how to make null values come last when sorting ascending
sql,Rename a column in MySQL
sql,Best practices for SQL varchar column length [closed]
sql,How to DROP multiple columns with a single ALTER TABLE statement in SQL Server?
sql,Entity Framework. Delete all rows in table
sql,How to convert DateTime to VarChar
sql,INSERT with SELECT
sql,How do I check if a column is empty or null in MySQL?
sql,What is a stored procedure?
sql,How can I make SQL case sensitive string comparison on MySQL?
sql,How to check if a stored procedure exists before creating it
sql,Equals(=) vs. LIKE
sql,Error Code: 2013. Lost connection to MySQL server during query
sql,Oracle: how to UPSERT (update or insert into a table?)
sql,Recommended SQL database design for tags or tagging [closed]
sql,How can I copy data from one column to another in the same table?
sql,Altering column size in SQL Server
sql,How to get the top 10 values in postgresql?
sql,Reason for Column is invalid in the select list because it is not contained in either an aggregate function or the GROUP BY clause [duplicate]
sql,SET versus SELECT when assigning variables?
sql,Getting “Lock wait timeout exceeded; try restarting transaction” even though I'm not using a transaction
sql,Not equal <> != operator on NULL
sql,Convert Rows to columns using 'Pivot' in SQL Server
sql,MySQL LIKE IN()?
sql,"Drop all the tables, stored procedures, triggers, constraints and all the dependencies in one sql statement"
sql,ROW_NUMBER() in MySQL
sql,How to declare a variable in a PostgreSQL query
sql,How do I get the size of a java.sql.ResultSet?
sql,"What's faster, SELECT DISTINCT or GROUP BY in MySQL?"
sql,Best way to do multi-row insert in Oracle?
sql,How to get first character of a string in SQL?
sql,Combining “LIKE” and “IN” for SQL Server [duplicate]
sql,Cast from VARCHAR to INT - MySQL
sql,MySQL SELECT only not null values
sql,How do I find duplicate values in a table in Oracle?
sql,Extract date (yyyy/mm/dd) from a timestamp in PostgreSQL
sql,How to store decimal values in SQL Server?
sql,What is the difference between JOIN and UNION?
sql,How can I create a copy of an Oracle table without copying the data?
sql,SELECT DISTINCT on one column
sql,How to fetch the row count for all tables in a SQL SERVER database [duplicate]
sql,"SQL keys, MUL vs PRI vs UNI"
sql,Why do you create a View in a database?
sql,Reset auto increment counter in postgres
sql,Is there any boolean type in Oracle databases?
sql,How to select date without time in SQL
sql,Max length for client ip address [duplicate]
sql,SQL Server Insert if not exists
sql,Saving changes after table edit in SQL Server Management Studio
sql,"error, string or binary data would be truncated when trying to insert"
sql,T-SQL: Deleting all duplicate rows but keeping one [duplicate]
sql,How to convert all tables from MyISAM into InnoDB?
sql,What are the use cases for selecting CHAR over VARCHAR in SQL?
sql,Difference between “read commited” and “repeatable read”
sql,What are the pros and cons to keeping SQL in Stored Procs versus Code [closed]
sql,Create unique constraint with null columns
sql,how do I query sql for a latest record date for each user
sql,Disable Rails SQL logging in console
sql,Why is SELECT * considered harmful?
sql,Oracle SQL: Update a table with data from another table
sql,How to set auto increment primary key in PostgreSQL?
sql,INNER JOIN vs LEFT JOIN performance in SQL Server
sql,Why would someone use WHERE 1=1 AND <conditions> in a SQL clause?
sql,Inner join vs Where
sql,SQL left join vs multiple tables on FROM line?
sql,MySQL INSERT INTO table VALUES.. vs INSERT INTO table SET
sql,SQL Server SELECT INTO @variable?
sql,MySQL search and replace some text in a field
sql,Postgresql GROUP_CONCAT equivalent?
sql,Oracle “Partition By” Keyword
sql,Create a date from day month and year with T-SQL
sql,What is the difference between HAVING and WHERE in SQL?
sql,What's the best practice for primary keys in tables?
sql,How does MySQL process ORDER BY and LIMIT in a query?
sql,Rails raw SQL example
sql,How can I add a column that doesn't allow nulls in a Postgresql database?
sql,Using an ORM or plain SQL? [closed]
sql,Can table columns with a Foreign Key be NULL?
sql,Syntax of for-loop in SQL Server
sql,Get records with max value for each group of grouped SQL results
sql,NULL values inside NOT IN clause
sql,How do I set a column value to NULL in SQL Server Management Studio?
sql,How do I do top 1 in Oracle?
sql,How to copy a row and insert in same table with a autoincrement field in MySQL?
sql,How to change a PG column to NULLABLE TRUE?
sql,"How to use DbContext.Database.SqlQuery<TElement>(sql, params) with stored procedure? EF Code First CTP5"
sql,SELECT * FROM X WHERE id IN (…) with Dapper ORM
sql,Script to kill all connections to a database (More than RESTRICTED_USER ROLLBACK)
sql,Adding a new SQL column with a default value
sql,How can I backup a remote SQL Server database to a local drive?
sql,difference between primary key and unique key
sql,How do I interpret precision and scale of a number in a database?
sql,MySQL OPTIMIZE all tables?
sql,What does ON [PRIMARY] mean?
sql,Select count(*) from multiple tables
sql,How do I query between two dates using MySQL?
sql,Need to list all triggers in SQL Server database with table name and table's schema
sql,How do I use an INSERT statement's OUTPUT clause to get the identity value?
sql,WHERE vs HAVING
sql,How do I list all the columns in a table?
sql,Remove all spaces from a string in SQL Server
sql,SQL Case Sensitive String Compare
sql,How do I drop a foreign key constraint only if it exists in sql server?
sql,Correct use of transactions in SQL Server
sql,How do you return the column names of a table?
sql,mysql update column with value from another table
sql,SQL JOIN and different types of JOINs
sql,How do you import a large MS SQL .sql file?
sql,How to randomly select rows in SQL?
sql,How do I create a foreign key in SQL Server?
sql,How to execute raw SQL in Flask-SQLAlchemy app
sql,"SQL server query to get the list of columns in a table along with Data types, NOT NULL, and PRIMARY KEY constraints"
sql,INSERT statement conflicted with the FOREIGN KEY constraint - SQL Server
sql,How can I group by date time column without taking time into consideration
sql,How to deal with SQL column names that look like SQL keywords?
sql,"Check if a row exists, otherwise insert"
sql,Fastest way to count exact number of rows in a very large table?
sql,How to use count and group by at the same select statement
sql,When to use Common Table Expression (CTE)
sql,How to check for Is not Null And Is not Empty string in SQL server?
sql,What is the difference between single and double quotes in SQL?
sql,List columns with indexes in PostgreSQL
sql,PostgreSQL: Give all permissions to a user on a PostgreSQL database
sql,What does SQL clause “GROUP BY 1” mean?
sql,"Is there a performance difference between CTE , Sub-Query, Temporary Table or Table Variable?"
sql,What are the most common SQL anti-patterns? [closed]
sql,Generate class from database table
sql,Postgres: SQL to list table foreign keys
sql,Does MS SQL Server's “between” include the range boundaries?
sql,Counting DISTINCT over multiple columns
sql,Use email address as primary key?
sql,Count the occurrences of DISTINCT values
sql,Best way to work with dates in Android SQLite [closed]
sql,SQL - Rounding off to 2 decimal places
sql,Case insensitive searching in Oracle
sql,COUNT(*) vs. COUNT(1) vs. COUNT(pk): which is better? [duplicate]
sql,SQL: How to properly check if a record exists
sql,Finding duplicate rows in SQL Server
sql,MySQL dump by query
sql,Is it possible to GROUP BY multiple columns using MySQL?
sql,PostgreSQL DISTINCT ON with different ORDER BY
sql,What did MongoDB not being ACID compliant before v4 really mean?
sql,Storing JSON in database vs. having a new column for each key
sql,"MySQL, better to insert NULL or empty string?"
sql,How to speed up insertion performance in PostgreSQL
sql,Convert Datetime column from UTC to local time in select statement
sql,How to get script of SQL Server data? [duplicate]
sql,How to write UPDATE SQL with Table alias in SQL Server 2008?
sql,ERROR: permission denied for sequence cities_id_seq using Postgres
sql,How do I convert from BLOB to TEXT in MySQL?
sql,Difference between left join and right join in SQL Server [duplicate]
sql,SQL - HAVING vs. WHERE
sql,Select top 10 records for each category
sql,Use variable with TOP in select statement in SQL Server without making it dynamic [duplicate]
sql,Find rows that have the same value on a column in MySQL
sql,SQL WITH clause example [duplicate]
sql,SQL select join: is it possible to prefix all columns as 'prefix.*'?
sql,Find a string by searching all tables in SQL Server Management Studio 2008
sql,Can I use multiple “with”?
sql,PostgreSQL delete with inner join
sql,"In Postgresql, force unique on combination of two columns"
sql,How to move columns in a MySQL table?
sql,How to round an average to 2 decimal places in PostgreSQL?
sql,How to find duplicate records in PostgreSQL
sql,List all tables in postgresql information_schema
sql,The ALTER TABLE statement conflicted with the FOREIGN KEY constraint
sql,Update multiple rows in same query using PostgreSQL
sql,Check if value exists in Postgres array
sql,MySQL's now() +1 day
sql,How to update Identity Column in SQL Server?
sql,Simple way to calculate median with MySQL
sql,PostgreSQL Crosstab Query
sql,Why does Oracle 9i treat an empty string as NULL?
sql,How do I query using fields inside the new PostgreSQL JSON datatype?
sql,Does the join order matter in SQL?
sql,Convert Month Number to Month Name Function in SQL
sql,MySQL ON DUPLICATE KEY UPDATE for multiple rows insert in single query
sql,Best data type for storing currency values in a MySQL database
sql,sql query to return differences between two tables
sql,Turn off constraints temporarily (MS SQL)
sql,How to order by with union in SQL?
sql,Convert timestamp to date in MySQL query
sql,Add primary key to existing table
sql,Optimise PostgreSQL for fast testing
sql,How to compare dates in datetime fields in Postgresql?
sql,Difference between natural join and inner join
sql,Oracle Differences between NVL and Coalesce
sql,Is SQL syntax case sensitive?
sql,Inserting data into a temporary table
sql,How to create a table from select query result in SQL Server 2008 [duplicate]
sql,SQL: IF clause within WHERE clause
sql,Using column alias in WHERE clause of MySQL query produces an error
sql,Modify table: How to change 'Allow Nulls' attribute from not null to allow null
sql,How can I find which tables reference a given table in Oracle SQL Developer?
sql,How do I execute a stored procedure once for each row returned by query?
sql,SQL Server dynamic PIVOT query?
sql,SQL RANK() versus ROW_NUMBER()
sql,Condition within JOIN or WHERE
sql,"What is the difference between Scope_Identity(), Identity(), @@Identity, and Ident_Current()?"
sql,Foreign key constraints: When to use ON UPDATE and ON DELETE
sql,How to update two tables in one statement in SQL Server 2005?
sql,MySQL - Rows to Columns
sql,How to combine date from one field with time from another field - MS SQL Server
sql,How to alter a column and change the default value?
sql,The multi-part identifier could not be bound
sql,What are best practices for multi-language database design? [closed]
sql,Can someone copyright a SQL query? [closed]
sql,mysql Foreign key constraint is incorrectly formed error
sql,Most efficient T-SQL way to pad a varchar on the left to a certain length?
sql,"In SQL, what's the difference between count(column) and count(*)?"
sql,Recover unsaved SQL query scripts
sql,How do I put an 'if clause' in an SQL string?
sql,What is best tool to compare two SQL Server databases (schema and data)? [duplicate]
sql,SQL Server - transactions roll back on error?
sql,Changing the maximum length of a varchar column?
sql,Creating an index on a table variable
sql,Alter a MySQL column to be AUTO_INCREMENT
sql,Cannot simply use PostgreSQL table name (“relation does not exist”)
sql,“where 1=1” statement [duplicate]
sql,Set database from SINGLE USER mode to MULTI USER
sql,How to drop SQL default constraint without knowing its name?
sql,"MySQL: How to copy rows, but change a few fields?"
sql,ALTER TABLE to add a composite primary key
sql,Effect of NOLOCK hint in SELECT statements
sql,SQL: How to get the count of each distinct value in a column?
sql,Import CSV file into SQL Server
sql,Truncate (not round) decimal places in SQL Server
sql,How to update only one field using Entity Framework?
sql,JOIN two SELECT statement results
sql,How to drop all tables from a database with one SQL query?
sql,Set NOW() as Default Value for datetime datatype?
sql,SQL Server equivalent of MySQL's NOW()?
sql,Why historically do people use 255 not 256 for database field magnitudes?
sql,sqlite database default time value 'now'
sql,PostgreSQL create table if not exists
sql,"Can I add a UNIQUE constraint to a PostgreSQL table, after it's already created?"
sql,I want to use CASE statement to update some records in sql server 2005
sql,How to export all data from table to an insertable sql format?
sql,Multi-statement Table Valued Function vs Inline Table Valued Function
sql,#1273 – Unknown collation: ‘utf8mb4_unicode_520_ci’
sql,How to calculate percentage with a SQL statement
sql,Best way to check for “empty or null value”
sql,is it possible to select EXISTS directly as a bit?
sql,How to select records from last 24 hours using SQL?
sql,When do I need to use a semicolon vs a slash in Oracle SQL?
sql,How to create a SQL Server function to “join” multiple rows from a subquery into a single delimited field? [duplicate]
sql,django test app error - Got an error creating the test database: permission denied to create database
sql,How to use RETURNING with ON CONFLICT in PostgreSQL?
sql,INSERT … ON DUPLICATE KEY (do nothing)
sql,SQL to LINQ Tool [closed]
sql,How do I ALTER a PostgreSQL table and make a column unique?
sql,Replacing NULL with 0 in a SQL server query
sql,How to select multiple rows filled with constants?
sql,How to change the default collation of a table?
sql,selecting unique values from a column
sql,Fastest check if row exists in PostgreSQL
sql,How to list active connections on PostgreSQL?
sql,Are database triggers evil? [closed]
sql,Import SQL file into mysql
sql,Best way to do nested case statement logic in SQL Server
sql,"In SQL, how can you “group by” in ranges?"
sql,Cannot delete or update a parent row: a foreign key constraint fails
sql,"mySQL :: insert into table, data from another table?"
sql,SQL query for finding records where count > 1
sql,SQL Logic Operator Precedence: And and Or
sql,Change Schema Name Of Table In SQL
sql,MySQL/SQL: Group by date only on a Datetime column
