go,[]
javascript,jQuery Event Keypress: Which key was pressed?
javascript,How to set focus on an input field after rendering?
javascript,React js onClick can't pass value to method
javascript,JavaScript unit test tools for TDD
javascript,Fastest method to replace all instances of a character in a string [duplicate]
javascript,Wait until all jQuery Ajax requests are done?
javascript,How to set a JavaScript breakpoint from code in Chrome?
javascript,Getting the client's time zone (and offset) in JavaScript
javascript,jQuery Ajax POST example with PHP
javascript,What is the use of the JavaScript 'bind' method?
javascript,Babel 6 regeneratorRuntime is not defined
javascript,No 'Access-Control-Allow-Origin' header is present on the requested resource—when trying to get data from a REST API
javascript,Check if a user has scrolled to the bottom
javascript,Strip HTML from Text JavaScript
javascript,Execute a command line binary with Node.js
javascript,Creating a new DOM element from an HTML string using built-in DOM methods or Prototype
javascript,How do I store an array in localStorage? [duplicate]
javascript,Check if an element contains a class in JavaScript?
javascript,How to remove text from a string?
javascript,How to delay the .keyup() handler until the user stops typing?
javascript,How do I pass variables and data from PHP to JavaScript?
javascript,Preloading images with jQuery
javascript,"Using Node.JS, how do I read a JSON file into (server) memory?"
javascript,"What techniques can be used to define a class in JavaScript, and what are their trade-offs?"
javascript,How do I enumerate the properties of a JavaScript object? [duplicate]
javascript,How do I conditionally add attributes to React components?
javascript,How to check whether an object is a date?
javascript,How to subtract days from a plain Date?
javascript,How do I access previous promise results in a .then() chain?
javascript,Google Maps JS API v3 - Simple Multiple Marker Example
javascript,What is VanillaJS?
javascript,Generate a Hash from string in Javascript
javascript,Updating address bar with new URL without hash or reloading the page [duplicate]
javascript,Include another HTML file in a HTML file
javascript,How to access the first property of a Javascript object?
javascript,Get class list for element with jQuery
javascript,Most efficient way to create a zero filled JavaScript array?
javascript,How to count string occurrence in string?
javascript,How do I bind to list of checkbox values with AngularJS?
javascript,ECMAScript 6 arrow function that returns an object
javascript,Difference between npx and npm?
javascript,How to deal with floating point number precision in JavaScript?
javascript,How to detect if JavaScript is disabled?
javascript,Remove ALL white spaces from text
javascript,Fastest way to duplicate an array in JavaScript - slice vs. 'for' loop
javascript,Fetch: POST json data
javascript,jQuery selectors on custom data attributes using HTML5
javascript,What is “export default” in JavaScript?
javascript,Repeat a string in JavaScript a number of times
javascript,jQuery checkbox checked state changed event
javascript,How do I view events fired on an element in Chrome DevTools?
javascript,jQuery: Get selected element tag name
javascript,How do you convert a JavaScript date to UTC?
javascript,How do I check for null values in JavaScript?
javascript,How to get image size (height & width) using JavaScript?
javascript,How to get first character of string?
javascript,How to find if an array contains a specific string in JavaScript/jQuery? [duplicate]
javascript,Why does JavaScript only work after opening developer tools in IE once?
javascript,Selecting last element in JavaScript array [duplicate]
javascript,How to identify if a webpage is being loaded inside an iframe or directly into the browser window?
javascript,How do I remove objects from a JavaScript associative array?
javascript,document.getElementById vs jQuery $()
javascript,jQuery to loop through elements with the same class
javascript,How to initialize an array's length in JavaScript?
javascript,JavaScript window resize event
javascript,Show or hide element in React
javascript,SecurityError: Blocked a frame with origin from accessing a cross-origin frame
javascript,Node.js on multi-core machines
javascript,Invoking JavaScript code in an iframe from the parent page
javascript,How to break/exit from a each() function in JQuery? [duplicate]
javascript,Get difference between 2 dates in JavaScript? [duplicate]
javascript,Remove CSS class from element with JavaScript (no jQuery) [duplicate]
javascript,Syntax for async arrow function
javascript,What is the difference between state and props in React?
javascript,HTML form readonly SELECT tag/input
javascript,Is JavaScript guaranteed to be single-threaded?
javascript,Check if an element is present in an array [duplicate]
javascript,Is there a way to detect if a browser window is not currently active?
javascript,Split array into chunks
javascript,"What is the difference between screenX/Y, clientX/Y and pageX/Y?"
javascript,Remove Object from Array using JavaScript
javascript,Escaping HTML strings with jQuery
javascript,RGB to hex and hex to RGB
javascript,How to remove spaces from a string using JavaScript?
javascript,Get class name using jQuery
javascript,How can I force clients to refresh JavaScript files?
javascript,jQuery checkbox change and click event
javascript,How to check if a string is a valid JSON string in JavaScript without using Try/Catch
javascript,Call child method from parent
javascript,Check if object is a jQuery object
javascript,Bootstrap modal appearing under background
javascript,How can I do string interpolation in JavaScript?
javascript,How to unset a JavaScript variable?
javascript,How can I run multiple npm scripts in parallel?
javascript,"Difference between Grunt, NPM and Bower ( package.json vs bower.json )"
javascript,Delete first character of a string in Javascript
javascript,Sort JavaScript object by key
javascript,Add a tooltip to a div
javascript,Huge number of files generated for every Angular project
javascript,Read a file one line at a time in node.js?
javascript,How do I replace a character at a particular index in JavaScript?
javascript,How to debug JavaScript / jQuery event bindings with Firebug or similar tools?
javascript,Check/Uncheck checkbox with JavaScript
javascript,HTML5 Local storage vs. Session storage
javascript,Most efficient method to groupby on an array of objects
javascript,What is the purpose of wrapping whole Javascript files in anonymous functions like “(function(){ … })()”?
javascript,Script Tag - async & defer
javascript,Why is the result of ('b'+'a'+ + 'a' + 'a').toLowerCase() 'banana'?
javascript,Convert string to title case with JavaScript
javascript,How to check if function exists in JavaScript?
javascript,How to get first N number of elements from an array
javascript,jQuery selector regular expressions
javascript,Are 'Arrow Functions' and 'Functions' equivalent / interchangeable?
javascript,Formatting a number with exactly two decimals in JavaScript
javascript,How do I replace all line breaks in a string with <br /> elements?
javascript,How to output numbers with leading zeros in JavaScript? [duplicate]
javascript,Maximum call stack size exceeded error
html,Why does HTML think “chucknorris” is a color?
html,How do I check whether a checkbox is checked in jQuery?
html,How to horizontally center an element
html,"Which “href” value should I use for JavaScript links, “#” or “javascript:void(0)”?"
html,Change a HTML5 input's placeholder color with CSS
html,Set cellpadding and cellspacing in CSS?
html,How can I change an element's class with JavaScript?
html,How do you disable browser Autocomplete on web form field / input tag?
html,Is it possible to apply CSS to half of a character?
html,How do I disable the resizable property of a textarea?
html,How can I know which radio button is selected via jQuery?
html,Storing Objects in HTML5 localStorage
html,I need an unordered list without any bullets
html,How do I modify the URL without reloading the page?
html,How do I vertically center text with CSS? [duplicate]
html,How do I give text or an image a transparent background using CSS?
html,How to make a div 100% height of the browser window
html,How can I make a div not larger than its contents?
html,"HTML 5: Is it <br>, <br/>, or <br />?"
html,Make a div fill the height of the remaining screen space
html,"Get the size of the screen, current web page and browser window"
html,How to create an HTML button that acts like a link?
html,What are valid values for the id attribute in HTML?
html,Vertically align text next to an image?
html,How to align checkboxes and their labels consistently cross-browsers
html,"Retrieve the position (X,Y) of an HTML element relative to the browser window"
html,How to move an element into another element?
html,<button> vs. <input type=“button” />. Which to use?
html,How do I auto-resize an image to fit a 'div' container?
html,RegEx match open tags except XHTML self-contained tags
html,How do I make a placeholder for a 'select' box?
html,Convert HTML + CSS to PDF [closed]
html,Redirect from an HTML page
html,How can I set the default value for an HTML <select> element?
html,Where should I put <script> tags in HTML markup?
html,Creating a div element in jQuery [duplicate]
html,<meta charset=“utf-8”> vs <meta http-equiv=“Content-Type”>
html,Pure JavaScript equivalent of jQuery's $.ready() - how to call a function when the page/DOM is ready for it [duplicate]
html,What does enctype='multipart/form-data' mean?
html,What does <meta http-equiv=“X-UA-Compatible” content=“IE=edge”> do?
html,How do I style a <select> dropdown with only CSS?
html,Why don't self-closing script elements work?
html,How do I reformat HTML code using Sublime Text 2?
html,How can I select an element by name with jQuery?
html,"Hide scroll bar, but while still being able to scroll"
html,How to change the href for a hyperlink using jQuery
html,How do I vertically align text in a div?
html,Check if checkbox is checked with jQuery
html,What characters can be used for up/down triangle (arrow without stem) for display in HTML?
html,jQuery document.createElement equivalent?
html,Recommended way to embed PDF in HTML?
html,offsetting an html anchor to adjust for fixed header [duplicate]
html,How to align content of a div to the bottom
html,What is the purpose of the “role” attribute in HTML?
html,jQuery Get Selected Option From Dropdown
html,Open link in new tab or window [duplicate]
html,Maintain the aspect ratio of a div with CSS
html,How do I remove the space between inline/inline-block elements?
html,Local Storage vs Cookies
html,How to write a:hover in inline CSS?
html,How to clear the canvas for redrawing
html,Selecting element by data attribute with jQuery
html,How to apply CSS to iframe?
html,How to overlay one div over another div
html,Can I hide the HTML5 number input’s spin box?
html,How to create a checkbox with a clickable label?
html,Adding HTML entities using CSS content
html,How can I tell if a DOM element is visible in the current viewport?
html,What is a clearfix?
html,How do you keep parents of floated elements from collapsing? [duplicate]
html,Get the value in an input text box
html,Use jQuery to hide a DIV when the user clicks outside of it
html,What is the difference between <section> and <div>?
html,How to prevent buttons from submitting forms
html,Tab space instead of multiple non-breaking spaces (“nbsp”)?
html,How can I center text (horizontally and vertically) inside a div block?
html,Using HTML5/Canvas/JavaScript to take in-browser screenshots
html,How do I retrieve an HTML element's actual width and height?
html,Can I set subject/content of email using mailto:?
html,WebSockets vs. Server-Sent events/EventSource
html,Is there a float input type in HTML5?
html,How to allow only numeric (0-9) in HTML  inputbox using jQuery?
html,vertical-align with Bootstrap 3
html,Make body have 100% of the browser height
html,When is a CDATA section necessary within a script tag?
html,HTML text input allow only numeric input
html,How to style a checkbox using CSS
html,How to get the data-id attribute?
html,Scroll to bottom of div?
html,How to vertically align elements in a div?
html,How to disable a link using only CSS?
html,jQuery disable/enable submit button
html,How to align a <div> to the middle (horizontally/width) of the page [duplicate]
html,Can HTML checkboxes be set to readonly?
html,Is there any way to change input type=“date” format?
html,Styling an input type=“file” button
html,Prevent users from submitting a form by hitting Enter
html,How to make JavaScript execute after page load?
html,"What's the difference between <b> and <strong>, <i> and <em>?"
html,Changing the color of an hr element
html,How can I position my div at the bottom of its container?
html,How to display HTML in TextView?
html,Should I make HTML Anchors with 'name' or 'id'?
html,How do I wrap text in a pre tag?
html,How to remove close button on the jQuery UI dialog?
html,How to play audio?
html,How to Right-align flex item?
html,Space between two rows in a table?
html,When to use IMG vs. CSS background-image?
html,How to apply !important using .css()?
html,Using jQuery to center a DIV on the screen
html,How to select a radio button by default? [duplicate]
html,Difference between id and name attributes in HTML
html,What is sr-only in Bootstrap 3?
html,Remove border from IFrame
html,Flexbox: center horizontally and vertically
html,How to center a “position: absolute” element
html,How to display Base64 images in HTML?
html,An invalid form control with name='' is not focusable
html,Limit file format when using <input type=“file”>?
html,HTML-encoding lost when attribute read from input field
html,Text-align class for inside a table
html,How do you handle multiple submit buttons in ASP.NET MVC Framework?
html,Capture HTML Canvas as gif/jpg/png/pdf?
html,CSS Background Opacity [duplicate]
html,How do you easily horizontally center a <div> using CSS? [duplicate]
html,Can I use a :before or :after pseudo-element on an input field?
html,Can I write a CSS selector selecting elements NOT having a certain class or attribute?
html,Adding a favicon to a static HTML page
html,How does Zalgo text work?
html,Strip HTML from Text JavaScript
html,How do I store an array in localStorage? [duplicate]
html,Check if an element contains a class in JavaScript?
html,How do search engines deal with AngularJS applications?
html,Are (non-void) self-closing tags valid in HTML5?
html,Resize image proportionally with CSS? [duplicate]
html,Include another HTML file in a HTML file
html,Get class list for element with jQuery
html,How to detect if JavaScript is disabled?
html,Why not use tables for layout in HTML? [closed]
html,Stretch and scale CSS background
html,How To Auto-Format / Indent XML/HTML in Notepad++
html,"Do I use <img>, <object>, or <embed> for SVG files?"
html,How to add a browser tab icon (favicon) for a website?
html,Determine a user's timezone
html,Should I put input elements inside a label element?
html,Invoking JavaScript code in an iframe from the parent page
html,How to use HTML Agility pack
html,Remove CSS class from element with JavaScript (no jQuery) [duplicate]
html,HTML form readonly SELECT tag/input
html,Is there a minlength validation attribute in HTML5?
html,Get class name using jQuery
html,Disabling Chrome Autofill
html,Add a tooltip to a div
html,Disable Auto Zoom in Input “Text” tag - Safari on iPhone
html,HTML5 Local storage vs. Session storage
html,Can we have multiple <tbody> in same <table>?
html,Making a div vertically scrollable using CSS
html,Script Tag - async & defer
html,Find out whether radio button is checked with JQuery?
html,How to change the color of header bar and address bar in newest Chrome version on Lollipop?
html,Word-wrap in an HTML table
html,Get checkbox value in jQuery
html,"What is the difference between localStorage, sessionStorage, session and cookies?"
html,Maximum call stack size exceeded error
html,Selecting all text in HTML text input when clicked
html,Should I use <i> tag for icons instead of <span>? [closed]
html,Set cookie and get cookie with JavaScript [duplicate]
html,Vertically centering a div inside another div [duplicate]
html,What is the max size of localStorage values?
html,Expand a div to fill the remaining width
html,How to force child div to be 100% of parent div's height without specifying parent's height?
html,What is the difference between HTML tags <div> and <span>?
html,Two submit buttons in one form
html,Can one AngularJS controller call another?
html,Outline radius?
html,jQuery.click() vs onClick
html,Is it possible to set the equivalent of a src attribute of an img tag in CSS?
html,Set the table column width constant regardless of the amount of text in its cells?
html,Cross-reference (named anchor) in markdown
html,How do you get centered content using Twitter Bootstrap?
html,Image inside div has extra space below the image
html,Why do browsers match CSS selectors from right to left?
html,HTML5 best practices; section/header/aside/article elements
html,Can I make a <button> not submit a form?
html,jQuery/JavaScript to replace broken images
html,HTML Input=“file” Accept Attribute File Type (CSV)
html,Embedding Base64 Images
html,Make a div into a link
html,How to disable the resize grabber of <textarea>? [duplicate]
html,Best way to center a <div> on a page vertically and horizontally? [duplicate]
html,Make iframe automatically adjust height according to the contents without using scrollbar? [duplicate]
html,How to dynamically change a web page's title?
html,Multiple line code example in Javadoc comment
html,Is putting a div inside an anchor ever correct?
html,Clearing <input type='file' /> using jQuery
html,Placing border inside of div and not on its edge
html,Minimum and maximum value of z-index?
html,Can I create links with 'target=“_blank”' in Markdown?
html,How do I escape ampersands in XML so they are rendered as entities in HTML?
html,How to turn off word wrapping in HTML?
html,HTML input - name vs. id [duplicate]
html,How to affect other elements when one element is hovered
html,Center image using text-align center?
html,Proper way to make HTML nested list?
html,Chrome ignores autocomplete=“off”
html,How to add some non-standard font to a website?
html,How to prevent line breaks in list items using CSS
html,default select option as blank
html,How to trigger a phone call when clicking a link in a web page on mobile phone
html,Stylesheet not loaded because of MIME-type
html,What is the purpose of the HTML “no-js” class?
html,Position absolute but relative to parent
html,jQuery Data vs Attr?
html,What do &lt; and &gt; stand for?
html,target=“_blank” vs. target=“_new”
html,What is Bootstrap?
html,How to send FormData objects with Ajax-requests in jQuery? [duplicate]
html,AngularJS ngClass conditional
html,CSS overflow-x: visible; and overflow-y: hidden; causing scrollbar issue
html,PHP mail function doesn't complete sending of e-mail
html,Select elements by attribute in CSS
html,Prevent Bootstrap Modal from disappearing when clicking outside or pressing escape? [duplicate]
html,Max parallel http connections in a browser?
html,How to trigger a file download when clicking an HTML button or JavaScript
html,Best way to track onchange as-you-type in input type=“text”?
html,"Using relative URL in CSS file, what location is it relative to?"
html,Can I change the checkbox size using CSS?
html,HTML5 Canvas vs. SVG vs. div
html,Set the value of an input field
html,How to vertically align text inside a flexbox?
html,CSS hide scroll bar if not needed
html,Using .otf fonts on web browsers
html,how to make a whole row in a table clickable as a link?
html,Height equal to dynamic width (CSS fluid layout) [duplicate]
html,Can you nest html forms?
html,How to mark-up phone numbers?
html,Alternate table row color using CSS?
html,How to allow <input type=“file”> to accept only image files?
html,Click button copy to clipboard using jQuery
html,How to close current tab in a browser window?
html,How do I programmatically set the value of a select box element using JavaScript?
html,How do I keep two side-by-side divs the same height?
html,CSS - Expand float child DIV height to parent's height
html,Is it valid to replace http:// with // in a <script src=“http://…”>?
html,What are the recommendations for html <base> tag?
html,Align an element to bottom with flexbox
html,How to find elements by class
html,What's the difference between disabled=“disabled” and readonly=“readonly” for HTML form input fields?
html,Binding select element to object in Angular
html,How to use the “required” attribute with a “radio” input field
html,What is the difference between properties and attributes in HTML?
html,Convert HTML to PDF in .NET
html,What is the boundary in multipart/form-data?
html,How to open link in a new tab in HTML?
html,"HTML table with 100% width, with vertical scroll inside tbody [duplicate]"
html,Is there a <meta> tag to turn off caching in all browsers? [duplicate]
html,What's the proper value for a checked attribute of an HTML checkbox?
html,How to make a div fill a remaining horizontal space?
html,How to center an element horizontally and vertically
html,Multiple lines of input in <input type=“text” />
html,jQuery Set Cursor Position in Text Area
html,Change the image source on rollover using jQuery
html,How can I make a TextArea 100% width without overflowing when padding is present in CSS?
html,"How to line-break from css, without using <br />?"
html,How to force a line break in a long word in a DIV?
html,Why does CSS work with fake elements?
html,Remove HTML tags from a String
html,Submitting a form on 'Enter' with jQuery?
html,Add border-bottom to table row <tr>
html,How to set input type date's default value to today?
html,"Understanding offsetWidth, clientWidth, scrollWidth and -Height, respectively"
html,Disable validation of HTML5 form elements
html,How do I right align div elements?
html,How to delete a localStorage item when the browser window/tab is closed?
html,Google Maps API v3: How to remove all markers?
html,Frame Buster Buster … buster code needed
html,Center image horizontally within a div
html,Responsive image align center bootstrap 3
html,How do you disable viewport zooming on Mobile Safari?
html,What is the most efficient way to create HTML elements using jQuery?
html,Way to ng-repeat defined number of times instead of repeating over array?
html,How to make a HTML Page in A4 paper size page(s)?
html,Is there a W3C valid way to disable autocomplete in a HTML form?
html,Flexbox not giving equal width to elements
html,Resize HTML5 canvas to fit window
html,How to make an element width: 100% minus padding?
html,Clear form fields with jQuery
html,How do I change the text of a span element using JavaScript?
html,How to assign multiple classes to an HTML container? [closed]
html,How to make an image center (vertically & horizontally) inside a bigger div [duplicate]
html,Fixed page header overlaps in-page anchors
html,How to send HTTP request in java? [duplicate]
html,Tools to selectively Copy HTML+CSS+JS From A Specific Element of DOM [closed]
html,Should I use px or rem value units in my CSS? [closed]
html,Colspan all columns
html,SVG drop shadow using css3
html,What does “for” attribute do in HTML <label> tag?
html,Open URL in same window and in same tab
html,How to align 3 divs (left/center/right) inside another div?
html,Detect all changes to a <input type=“text”> (immediately) using JQuery
html,What is the motivation behind the introduction of preflight CORS requests?
html,Options for HTML scraping? [closed]
html,HTML button to NOT submit form
html,Creating a textarea with auto-resize
html,location.host vs location.hostname and cross-browser compatibility?
html,How to place two divs next to each other?
html,Can you provide some examples of why it is hard to parse XML and HTML with a regex? [closed]
html,What is the correct syntax of ng-include?
html,Slide right to left?
html,What is href=“#” and why is it used?
html,CSS fixed width in a span
html,What are the integrity and crossorigin attributes?
html,contenteditable change events
html,What is the meaning of polyfills in HTML5?
html,How can I limit possible inputs in a HTML5 “number” element?
html,"CSS background image to fit width, height should auto-scale in proportion"
html,"How to see an HTML page on Github as a normal rendered HTML page to see preview in browser, without downloading?"
html,Turn off iPhone/Safari input element rounding
html,CSS selector for text input fields?
html,Changing website favicon dynamically
html,Fit background image to div
html,(change) vs (ngModelChange) in angular
html,How to detect DIV's dimension changed?
html,jQuery removeClass wildcard
html,How to ignore HTML element from tabindex?
html,How do I add a tool tip to a span element?
html,Why does the jquery change event not trigger when I set the value of a select using val()?
html,How do you create a hidden div that doesn't create a line break or horizontal space?
html,Force IE compatibility mode off using tags
html,Why don't flex items shrink past content size?
html,href=“tel:” and mobile numbers
html,Can I have an onclick effect in CSS?
html,How to add default value for html <textarea>? [closed]
html,Detect iPad Mini in HTML5
html,How to force link from iframe to be opened in the parent window
html,CSS Display an Image Resized and Cropped
html,CSS3 100vh not constant in mobile browser
html,How to pass parameters using ui-sref in ui-router to controller
html,What's the effect of adding 'return false' to a click event listener?
